{"$id":"scoremosaic://st-omr/synthetic-reading-order/v1","$schema":"https://json-schema.org/draft/2020-12/schema","additionalProperties":false,"properties":{"boundaries":{"additionalProperties":false,"properties":{"attachments":{"const":false},"beamRelations":{"const":false},"chordRelations":{"const":false},"duration":{"const":false},"ensemble":{"const":false},"gateway":{"const":false},"gpu":{"const":false},"httpInference":{"const":false},"musicXml":{"const":false},"network":{"const":false},"notationGraph":{"const":false},"persistence":{"const":false},"pitch":{"const":false},"production":{"const":false},"realOmr":{"const":false},"training":{"const":false},"userInput":{"const":false},"voice":{"const":false}},"required":["realOmr","userInput","pitch","duration","voice","attachments","beamRelations","chordRelations","notationGraph","musicXml","httpInference","gateway","ensemble","training","network","gpu","persistence","production"],"type":"object"},"documentId":{"const":"synthetic-reading-order-v1"},"measureOrders":{"items":{"additionalProperties":false,"properties":{"measureId":{"pattern":"^measure[0-9]{3}$","type":"string"},"staffId":{"pattern":"^staff[0-9]{3}$","type":"string"},"symbolIds":{"items":{"pattern":"^s[0-9]{3}$","type":"string"},"maxItems":256,"minItems":1,"type":"array"}},"required":["measureId","staffId","symbolIds"],"type":"object"},"maxItems":256,"minItems":1,"type":"array"},"membershipArtifact":{"additionalProperties":false,"properties":{"canonicalSha256":{"pattern":"^[0-9a-f]{64}$","type":"string"},"documentId":{"const":"synthetic-symbol-membership-v1"}},"required":["documentId","canonicalSha256"],"type":"object"},"schemaVersion":{"const":"1.0"},"staffOrders":{"items":{"additionalProperties":false,"properties":{"staffId":{"pattern":"^staff[0-9]{3}$","type":"string"},"symbolIds":{"items":{"pattern":"^s[0-9]{3}$","type":"string"},"maxItems":256,"minItems":1,"type":"array"}},"required":["staffId","symbolIds"],"type":"object"},"maxItems":64,"minItems":1,"type":"array"}},"required":["schemaVersion","documentId","membershipArtifact","staffOrders","measureOrders","boundaries"],"title":"ScoreMosaic ST-OMR synthetic reading order v1","type":"object"}
